{
    "$schema": "http://json-schema.org/draft-04/schema#",
    "type": "object",
    "properties": {
        "Início_da_Sentença": {
            "type": "object",
            "properties": {
                "APIN": {
                    "type": "boolean"
                },
                "AC25": {
                    "type": "boolean"
                },
                "DM": {
                    "type": "boolean"
                },
                "Revel": {
                    "type": "boolean"
                },
                "Interesse": {
                    "type": "boolean"
                },
                "Prescrição": {
                    "type": "boolean"
                },
                "Ev_Cessação_Benef": {
                    "type": "boolean"
                },
                "Ev_Proposta_Acordo": {
                    "type": "boolean"
                },
                "Ev_Recusa_Acordo": {
                    "type": "boolean"
                },
                "Ev_Impug": {
                    "type": "boolean"
                },
                "Ev_INSS_Impug": {
                    "type": "boolean"
                }
            },
            "required": [
                "APIN",
                "AC25",
                "DM",
                "Revel",
                "Interesse",
                "Prescrição",
                "Ev_Cessação_Benef",
                "Ev_Proposta_Acordo",
                "Ev_Recusa_Acordo",
                "Ev_Impug",
                "Ev_INSS_Impug"
            ],
            "additionalProperties": false
        },
        "Resultado_do_Laudo": {
            "type": "object",
            "properties": {
                "DtPerícia": {
                    "type": "string"
                },
                "Ev_Laudo": {
                    "type": "integer"
                },
                "ConclusãoPerícia": {
                    "type": "string"
                },
                "PeríodoIncapacidadeAnterior": {
                    "type": "string"
                },
                "Reabilitação": {
                    "type": "string"
                }
            },
            "required": [
                "DtPerícia",
                "Ev_Laudo",
                "ConclusãoPerícia",
                "PeríodoIncapacidadeAnterior",
                "Reabilitação"
            ],
            "additionalProperties": false
        },
        "Qualidade_de_Segurado_pela_DCB": {
            "type": "object",
            "properties": {
                "ÚltimaDCB": {
                    "type": "string"
                },
                "ÚltimaDER_Indef": {
                    "type": "string"
                },
                "DII": {
                    "type": "string"
                },
                "Fonte_QS": {
                    "type": "string"
                }
            },
            "required": [
                "ÚltimaDCB",
                "ÚltimaDER_Indef",
                "DII",
                "Fonte_QS"
            ],
            "additionalProperties": false
        },
        "Extração_de_Vínculos_do_CNIS": {
            "type": "object",
            "properties": {
                "Rel_Vínculos": {
                    "type": "string"
                },
                "Dt_Primeiro_Recol": {
                    "type": "string"
                },
                "Dt_Rec_Ant": {
                    "type": "string"
                },
                "Comp_Rec_Ant": {
                    "type": "string"
                },
                "Lista_Comp_Antes_DII_Recol_Depois": {
                    "type": "string"
                },
                "Dt_1o_Recol_pósDII": {
                    "type": "string"
                }
            },
            "required": [
                "Rel_Vínculos",
                "Dt_Primeiro_Recol",
                "Dt_Rec_Ant",
                "Comp_Rec_Ant",
                "Lista_Comp_Antes_DII_Recol_Depois",
                "Dt_1o_Recol_pósDII"
            ],
            "additionalProperties": false
        },
        "Qualidade_de_Segurado_pelo_CNIS": {
            "type": "object",
            "properties": {
                "Ev_CNIS": {
                    "type": "integer"
                },
                "Ev_Seg_Desemprego": {
                    "type": "integer"
                },
                "Núm_Contrib_Sem_Perder_QS": {
                    "type": "integer"
                },
                "Total_Contrib": {
                    "type": "integer"
                },
                "Dt_Primeiro_Vínculo": {
                    "type": "string"
                },
                "Comp_DII": {
                    "type": "string"
                },
                "Últ_Comp_Ant_Incapac": {
                    "type": "string"
                },
                "Dt_Recol_Ant_Incapac": {
                    "type": "string"
                },
                "Dt_Ini_Último_Emprego": {
                    "type": "string"
                },
                "Dt_Fim_Último_Emprego": {
                    "type": "string"
                },
                "Últ_Comp_Contrib_Ant": {
                    "type": "string"
                },
                "Espécie_Antes_DII": {
                    "type": "string"
                }
            },
            "required": [
                "Ev_CNIS",
                "Ev_Seg_Desemprego",
                "Núm_Contrib_Sem_Perder_QS",
                "Total_Contrib",
                "Dt_Primeiro_Vínculo",
                "Comp_DII",
                "Últ_Comp_Ant_Incapac",
                "Dt_Recol_Ant_Incapac",
                "Dt_Ini_Último_Emprego",
                "Dt_Fim_Último_Emprego",
                "Últ_Comp_Contrib_Ant",
                "Espécie_Antes_DII"
            ],
            "additionalProperties": false
        },
        "Carência": {
            "type": "object",
            "properties": {
                "Dia_Perda_QS": {
                    "type": "string"
                },
                "Dia_Recupera_QS": {
                    "type": "string"
                },
                "Núm_Contrib_Antes_DII": {
                    "type": "integer"
                },
                "Dia_Recupera_QS_Antes_DII": {
                    "type": "string"
                },
                "Num_Comp_Antes_DII_Recol_Depois": {
                    "type": "integer"
                },
                "PatologiaIncapacitante": {
                    "type": "integer"
                },
                "DID": {
                    "type": "string"
                },
                "Filiação_Oportunista": {
                    "type": "boolean"
                }
            },
            "required": [
                "Dia_Perda_QS",
                "Dia_Recupera_QS",
                "Núm_Contrib_Antes_DII",
                "Dia_Recupera_QS_Antes_DII",
                "Num_Comp_Antes_DII_Recol_Depois",
                "PatologiaIncapacitante",
                "DID",
                "Filiação_Oportunista"
            ],
            "additionalProperties": false
        },
        "Fechamento_da_Sentença": {
            "type": "object",
            "properties": {
                "Possui_Carência": {
                    "type": "boolean"
                },
                "DER": {
                    "type": "string"
                },
                "Idade": {
                    "type": "integer"
                },
                "DII_Perm": {
                    "type": "string"
                },
                "DIB": {
                    "type": "string"
                },
                "Concede_Restabelece": {
                    "type": "boolean"
                },
                "ReabilitaçãoSugerida": {
                    "type": "string"
                },
                "DCB": {
                    "type": "string"
                },
                "DCB_90dias_hoje": {
                    "type": "string"
                },
                "DCB_6meses_hoje": {
                    "type": "string"
                },
                "Acréscimo25pc": {
                    "type": "boolean"
                },
                "DI_AC25": {
                    "type": "string"
                }
            },
            "required": [
                "Possui_Carência",
                "DER",
                "Idade",
                "DII_Perm",
                "DIB",
                "Concede_Restabelece",
                "ReabilitaçãoSugerida",
                "DCB",
                "DCB_90dias_hoje",
                "DCB_6meses_hoje",
                "Acréscimo25pc",
                "DI_AC25"
            ],
            "additionalProperties": false
        }
    },
    "required": [
        "Início_da_Sentença",
        "Resultado_do_Laudo",
        "Qualidade_de_Segurado_pela_DCB",
        "Extração_de_Vínculos_do_CNIS",
        "Qualidade_de_Segurado_pelo_CNIS",
        "Carência",
        "Fechamento_da_Sentença"
    ],
    "additionalProperties": false
}